numbers,comments
1,外形外观：暗夜紫，超级好看，高端大气上档次低调奢华有内涵。屏幕音效：屏幕细腻光滑。音质不错拍照效果：拍照清晰，广角镜头感十足运行速度：运行速度很快，软件安装几十个也不卡顿待机时间：待机时间长了，正常使用足够了
2,上午10点买的手机，下午4点就收到货了，京东物流真是太棒了。新手机就是不一样，紫色我特别喜欢的颜色，特别好用，一直都是pro max，追剧看电视很爽。外观达到心理预期，音效特别好，拍照录视频也惊艳到了，非常清晰，画质非常好！待机也很给力，一天一次电，充电的时候还有40%以上。外形外观：一切完好，没有一点瑕疵屏幕音效：屏幕细腻，立体声很棒，听歌很舒服拍照效果：无论远近，都能拍出运行速度：完全够用
3,很满意的一次购物外形外观：完美无瑕疵屏幕音效：嘎嘎给力拍照效果：比上一代质的飞跃运行速度：快的一比待机时间：续航一天轻度游戏完全够用。
4,手机打开的瞬间确实是惊艳到我的眼球了，屏幕颜色很是通透，不愧是三星的屏幕确实是不错，待机时间也很不错，尤其是续航时间也令人眼前一亮，配置就不过多说了，好评！
5,fPhone14PM真的太惊艳了，比较爱玩游戏，打游戏完全不会卡顿。打游戏真的太流畅了，真的非常喜 欢这个手机。外观很好看，手感拿看很有质感，屏幕看着非常好，抽照效果很不错，超长待机一整 天。颜色也好看，黑色看起来简单大气，非常的干净整洁。运行非常流畅，屏幕显示细腻，给人很舒 服的感觉，而且相机夜景提升很大，拍出来的效果 堪比佳能相机
6,外形外观：酷炫！完美！屏幕音效：顶级！拍照效果：超级棒??运行速度：速度与激情！飞上天！待机时间：一天轻松拿下！其他特色：非常好！
7,终于换上了，非常完美，外观简直不要太好看了。一直在用iPhone，音效也很好，速度流畅。本人只是用于通讯交流，偶尔刷刷视频，续航也很够。
8,快递已收到物流很快第二天就到了。一拿到手就迫不及待的拆开看了，真的挺漂亮，苹果手机颜值真的很高，第一次购买苹果手机。一拿到手上就彻底爱上了。虽然很多功能还不是很熟悉但是慢慢会上手的。苹果手机值得拥有。。
9,外形外观：优雅不失大气屏幕音效：效果特别好拍照效果：清新自然爆裂，完美运行速度：特别快，很给力
10,外形外观：暗夜紫很好看，手感很舒服待机时间：超长，不玩游戏的话可以用超过24小时拍照效果：有电影效果，很不错 超清
11,当初一直纠结买白色还是黑色 现在看来真的选对了 白色可以百搭手机壳 但用多了我感觉自己会有点审美疲劳 换成黑色之后直接高级了几个档次 比起白色 黑色更高级沉稳 走御姐风的可以试试 不会男性化 真的很高级 磨砂质感非常不错 安全下车～?
12,刚好是下午拿到的快递！迫不及待拆开，拿到阳台一看～这也太美了太美了。真的好绝绝子。好漂亮好漂亮的银白色，像渡上一层彩虹！太好看了
13,外形外观：紫色的，颜色真好看拍照效果：真实，无美颜的运行速度：没感觉到特别快待机时间：Max电池容量大、白天一整天可以不充电、这点明显好其他特色：就是太沉啦 像板砖累手
14,发货的速度很快，隔离一天就收到了手机是国行全新未拆封的、是正品手机上手手感很好，屏幕显示也很亮丽舒服打王者一点也不会卡顿，最高能到120hz
15,那我就浅谈一下我的使用体验吧。「第一次用苹果」表现还是很出色。首先，它的系统非常流畅，使用起来非常顺畅，从打开应用程序到浏览网页都非常快速。其次，手机的手感非常丝滑，触摸手机的时候，你会感觉到非常舒适的手感，让你感觉手机非常高端。然而，缺点就是手机的重量比较重，男生拿着都会感到累手。不过，这也是因为手机内部的硬件配置非常强大，所以它的重量也是可以理解的。女孩子要慎重啊！！！另外，信号有时候不太稳定。不管在办公室或者家里，联通只有2格信号别人的苹果13 联通都是满的！！经过和客服沟通，他们给出了重置网络的方法，结果问题还真的就解决了！！！离谱，明明新手机，啷个会这样。总体来说，我还是比较推荐这款iPhone 14 Pro Max，它的性能和体验都非常出色，是一款非常值得购买的手机。京东的服务也没得说，一个字 棒！
16,外形外观：苹果手机一如既往的精致感拉满屏幕音效：屏幕非常清楚，颜色艳丽拍照效果：拍照很稳，出片率高运行速度：流畅运行，没有卡顿
17,手机很大，刚开始有点不太习惯，用久了就觉得还可以。手机非常流程，完全不卡顿，界面简洁清晰，挑了我最喜欢的紫色，真的很百搭。灵动岛太可以了，不脱口罩也可以识别开锁，炒鸡方便。
18,电话信号是真的差，其他还可以
19,苹果手机，先进工业技术，使用感优，拍照优质。运行速度很快，屏幕分辩清晰，观感舒适。快递收到后，开箱，苹果的盒子上的封条口是黑的，明显有人动过，没想到自营产品会这样。
20,手机很快在约定的时间收到了，感觉比上一代更重一些，尺寸没啥变化，各种app更灵敏一些，新手机巡航要好很多
21,?小猫在午睡，?地球在转圈，商品收到咯，特别喜欢，一收到就迫不及待地打开了，家人也很满意，这次购物体验不错宝贝收到咯??，真的很棒呀！?质量真是没话说，非常满意！?开心开心?好！非常好！质量好，和实体店一样，颜色正，是我喜欢的
22,紫色紫色！永远的紫色&hellip;太太太太高级了，太有质感了～超级喜欢！超级喜欢！好看好看疯狂好看&hellip;物流也超级给力
23,正品很可以，很帅气的手机不错不错，灵动岛这个功能也很不错，快递也异常快虽然没有某补贴便宜但是放心，也速度快。
24,之前一直用的小屏 本来打算买pro 没货了 就买了pm确实挺重? 但是手感挺好 拍照比我之前的小13好太多 很满意
25,快递很快，发货到收货20分钟。前一天晚上10点多拍第二天早上九点多发货九点多到，光速达真的快。手机还没激活因为钢化膜和手机壳没到，等配件到起了就使用啦。外观验过了，没有瑕疵。在这家店买了10多个手机了不错?
26,每一年的iPhone都要更新，确实好，手感一流做工精致，拍照很好看，尤其是视频的杜比视界，拍出来太惊艳了
27,快递没得说，一如既往的给力，第一时间拆包装，还是有那种很精品的感觉，咱东还是不错的，包装很仔细、严实，总的来说这次是很满意的一次购物，不错不错。
28,外形外观：不错屏幕音效：不错拍照效果：很好运行速度：很快其他特色：信号不太好待机时间：还不错
29,特别特别满意，超级好看，客服很有礼貌，很客气，良心商家，支持！超出预期，质量很好，做工精细，满意包装很完美，颜值很高，感觉物超所值！客服也非常耐心细致，发货快物流给力，以后还会再来??
30,当时买的时候还在犹豫价格，买来之后一点都不后悔，而且物流还快，可以入手搞活动买的，外观和描述一致，美观实用，材质手感都不错，好评！宝贝已收到?，超级喜欢，颜值高又实用，超级喜欢！???物流速度真的是没话说，就是一个字：快。商品从外包装来看非常高档，真是一分钱一分货，贵有贵的道理
31,1，入手时已优惠几百。2，速度快，下单隔天到货。3，新颜色，正。4，摄像清晰。5，操作流畅。6，非连续用，待机一天。7，充电快，但是需要自购充电器。8，除充电，使用时无明显发热。汽车无线充电发热明显，慎用。
32,第一次用苹果，外观设计非常nice，系统操作还在慢慢习惯中，还有系统是真的很流畅，外放音质太好了，就是奔着这低音来的。电池也够用，高强度一天不是问题。
33,xr换的14pm，偶尔会有点卡，颜色看着还可以，我觉得也不重，我去实体店看着感觉好大，但是买回来也觉得还好，没有那么大。还有就是降价也挺快，价保过期时间也比较短，我之前都是在京东上买手机，用了一个星期后，觉得续航啥的也还行，还有就是价保时间希望延长。
34,之前的64G不太够了。最终还是喜欢苹果的外观设计，灵动岛也是眼前一亮心高刷用起来更加流畅了。好评！
35,手机收到了 一直在京东自营买 是正品哦 之前的XS Max 用了5年 现在还好好的 买来打王者荣耀 换着用 真心喜欢 爱了
36,苹果手机体验还是不错的，有点重，习惯了就好了，灰色颜色很好，显得成熟，灵动岛体验下还可以，只是应用适配比较少
37,久违了白色苹果，这几年追潮流每年都是流行色，等换来换去，感觉还是白色最经典，等什么15，便宜就是最大的优势
38,是正品很好用，价格便宜了很多，性价比超高，真的特别划算，包装也很高端大气上档次，值得购买?终于对它下手了，颜值是真的没话说?，材质很好，物美价廉，趁活动赶紧囤起来非常好，宝贝很高大上，质量很好，看上去就给人一种高级感，价格也合适，这次网购很愉快，大赞?
39,安卓安桌安卓安卓安卓
40,JD自营值得信赖，全新未拆封未激活产地中国，手感极佳，外观无敌爆炸好看，推荐各位购买，贵一点点，买个放心买个舒坦，巴适滴板
41,用苹果10年了，这次是直接从X换的14 pro max，以前的x用了4年，现在该退休了???。开箱的第一感觉是大，可能是之前用x用的习惯了，高刷的感觉非常好，非常丝滑流畅。电池续航也很给力，正常使用一天都用不完。外形外观：方方正正，手感好，稍微有些大屏幕音效：高刷新带来体验非常给力，oled屏幕清晰拍照效果：支持4k60帧，纵享丝滑运行速度：非常快，不发热其他特色：灵动岛目前还不太明白，希望以后能添加更多有趣的玩法
42,外形外观：外观超好看，是这个装逼的紫色的感觉屏幕音效：屏幕音效没的说，音效很好贼，屏幕丝滑，用起来很给力拍照效果：升级到4800万的像素，拍照还是很可以的啦运行速度：运行速度没啥问题，用起来很舒服待机时间：一般正常使用，不随时拿着玩，从早到晚还是可以坚持的。其他特色：京东安全下车
43,外形外观：非常棒，拿到手先跟客服核实了手机串码！开箱检查外观屏幕音效：不错！拍照效果：杠杠滴！运行速度：新机器很快，很溜！待机时间：用后追评
44,极好的手机，名不虚传，再升级外形外观：漂亮屏幕音效：极好拍照效果：极好运行速度：急快，流畅待机时间：可以其他特色：厚重，扎实好机！
45,外形外观：这款金色款依旧是给人一种视觉效果上面的舒适。屏幕音效：显示效果棒，声音播放清晰。拍照效果：拍照效果也很好。运行速度：打游戏运行非常流畅。待机时间：待机时间一般，毕竟电池容量只有这么点了。
46,外观和设计都很喜欢，颜色也很特别，手感很不错，舒服，大屏一直是我最爱，但就是太重了，续航能力稍微欠缺，拿在手上怕掉了，就是一个字太豪气了。
47,是正品，体验很好，第一次用苹果，没让我失望，系统非常流畅，用了一个月来评价的，用着非常顺手，牌照是一大亮点，非常真实，夜景也很漂亮，真的超级好用，屏幕显示也非常清晰，亮度调节合理不伤眼，
48,外形外观：好看，这个灵动岛现在还没玩明白屏幕音效：声音很棒！拍照效果：拍照效果不错，色彩还原度挺高的，就是夜景很尴尬运行速度：系统很棒待机时间：电池比以前耐用了，一天一冲其他特色：物流快，保证正品购买3C产品还得京东
49,型号：黑色，512GB外形外观：屏幕间隙小，摄像头更凸出，手机重量越来越重屏幕音效：屏幕清晰度非常高， 音效一如既往的好拍照效果：4800万像素确实很强，拍视频光线更好运行速度：很流畅，装再多APP也不怕待机时间：电池续航完全够用，暂时不考虑充电宝
50,外形外观：时尚，科技感十足，手感舒适屏幕音效：视觉效果很不错，120Hz自适应刷新率，只要网络跟得上，还是很顺滑的拍照效果：相机功能强大，4800万像素，光学防抖，拍摄时细节表现很突出运行速度：性能挺强大待机时间：待机时间看你在做什么，刷视频时电量是不够用的
51,外形外观：外形美观大气，造型时尚有个性有风格是苹果的经典风格。屏幕音效：屏幕显示细腻顺滑，有高刷真很流畅，色彩显示比真清洗，色差色度都很好色彩还原效果一流。音响效果高保真低中高音皆佳，声音悦耳动听。拍照效果：拍照效果也很好照片清晰度高，特别是夜景拍照更清晰，一后出门游玩不用带单反相机了。运行速度：手机运行速度快，色彩色度色差一流，苹果14的灵动岛很时尚很好玩这个新功能真好。
52,苹果1 4 PrOM ax终于到手啦，已经关注有一段时间了，赶上优惠抢到一部，暗紫色的特别高大尚，外形外观，屏幕音效，拍照效果，运行速度，以及待机时间都特别特别棒，超级喜欢?
53,外形外观：最近痴迷白色配银色，白色配黑色，实体店都没选到银色，这里竟然选到了，无与伦比的配色，我很喜欢。屏幕音效：第一次用Max，屏幕大一些，好像也没有大很多。拍照效果：还没试，应该很好吧。运行速度：一直信赖iOS的运行速度。
54,外形外观：非常好。现买小的了，感觉这个有点大。实际到手发现这个也不大，还好买的大的，屏幕音效：非常不错。拍照效果：可以，呈现效果杠杠的运行速度：非常快，用着也不赖待机时间：还可以，一天正常使用用不完其他特色：颜色杠杠的
55,外形外观：14promax给我的感觉既熟悉又新颖，成熟又不失时尚，高端大气上档次。屏幕音效：屏幕比之前的产品更加清晰悦目，音效更加立体悦耳拍照效果：拍照效果稳定，动态拍摄细节拍摄都无可挑剔，摄影技术小白也可以拍出大片。待机时间：待机时间比之前的产品出色很多，两天用了不到一半的电量，基本是待机状态下。
56,还不错，物流很快，一直在用这个牌子物流很快，质量很好，做工精细，颜色很正外形外观：很不错屏幕音效：还行拍照效果：还没有拍运行速度：还行待机时间：还行其他特色：还行
57,外形外观：非常的好看屏幕音效：音效震撼和我的21pro差不多拍照效果：拍照技术直接提升好几个层次运行速度：手机界的天花板
58,很好很喜欢速度很快  缺点电磁不经用没电太快快递是真的没的说外形外观：很好屏幕音效：很好拍照效果：非常好运行速度：很快待机时间：不长其他特色：还好
59,喜欢这款手机，质量杠杠滴好哈，包装好，发货快，使用起来得心应手，不晃眼，看视频清晰自然。赞赞赞???
60,包装：密实、没有破损、没有磕碰。外观：无瑕疵，无划痕、磕碰，镜头无灰尘，屏幕无坏点。白色的外观搭配金属边框，手感真的一级棒。内置：无激活全新正版，运行流畅无卡顿。拍照：后置摄像头真的可以超远摄像，甚至还可以看到皮肤上的毛孔。真的还是一如既往的满意，给力。??
61,外形外观：识别度高，手感舒适，大气上档次。屏幕音效：屏幕非常耐磕碰，质感真的很好，做的很不错。拍照效果：这款手机送给我女朋友的她很喜欢，拍照方面很不错，拍出来光线的对比度，非常饱满运行速度：开很多个后台也不卡顿，效果非常好待机时间：2天半
62,一般般，还没试过卫星电话
63,外形外观：暗紫色非常的漂亮，手感非常的棒，特别吸引眼球屏幕音效：屏幕显示非常清晰，色彩细腻，运行速度：A16芯片，绝对是行业最强，拍照效果：拍照效果一直都是龙头老大
64,苹果手机的品质毋庸置疑，硬件高端，软件领先，确实值得国产手机学习和追赶，电池的续航也是挺让人觉得惊艳的，使用体验很好，从视觉，听觉，触觉，都让人觉得贴心趁手。
65,外形外观：好看运行速度：苹果流畅度没话说 很不错待机时间：比我之前13pm的可以屏幕音效：买来比我之前的苹果要很大 很动听拍照效果：4800很不错
66,外形外观：一直喜欢苹果的外观，圆润有手感屏幕音效：效果比12max好太多拍照效果：拍照效果杠杠的，增添了很多新特色功能运行速度：运行速度流畅，不卡顿待机时间：待机时间优秀
67,实物很有分量感，大块头哈哈使用感也很不错，人脸识别很快速，开机迅速主要还是外观大气好看，像素很清晰很好
68,太惊艳了 这一代真的是很漂亮 虽然不是什么资深果粉 但是也觉得很好看 反应也很快 很流畅 大小适合 配上一个超薄壳 nice nice 很棒很喜欢很开心
69,外形外观：是我喜欢的样子屏幕音效：声音超级大拍照效果：相机需要调试运行速度：除了信号不好，反应很快待机时间：拿到手60个电一直用了六个小时
70,手机和窗片一样，非常耐用，王感很棒！里面配件也很全，塑料膜也没有拆，手机颜色好看，大气，拿在手上手感好，使用起来，速度挺快，大电量不用天天充电挺好。照相效果也挺好，带广角的，有景深感。 买的高配，性价比高，希望多用段时问。
71,很好，灵动到虽然没什么用处但是看了很炫很喜欢。电池的续航很好，早上8点到晚上8点，掉电20%，我之前的iPhone11就要掉电50%左右。拍照效果我可以说是目前所有手机里面拍照效果最好的
72,不错呢，金色很好看，外观越看越喜欢，用起来待机时间也很不错哦，在京东购买第三部苹果手机了，从6SPLUS跨越到14poromaxs 终于如愿以偿了！
73,快递包装很好，快递员很细心！拆机一看就是正品，比实体店优惠。手感超级舒服，开机使用很流畅，拍照很清晰，几部苹果手机都是京东购买的，都很好用。
74,手机太漂亮啦，手感好，有分量，一起买了电源适配器，保证质量，值得信赖，发货快，服务态度热情耐心！赞?
75,外形外观：方方正正经典造型屏幕音效：屏幕还不错，音效也不错拍照效果：中规中矩，摄像效果不错，4k视频很好运行速度：流畅待机时间：比以前iPhone好很多，基本能用一天没问题。
76,外形外观：非常好看，今年的黑色特别耐看屏幕音效：苹果手机音响很棒，声音很清晰拍照效果：拍照色彩很真实，我很喜欢待机时间：用了一天才充电，充电速度也挺快的了总体来说都不错，值得购买。
77,iPhone14ProMax的电池容量是4323毫安时，机身尺寸比较大，为6.7英寸。所以，在寸土寸金的机身内部，苹果能塞下如此大容量的电池，实在是诚意到位。当然，大容量电池，加上苹果在软件、硬件方面的优化能力，iPhone14ProMax电池续航很强。按照我的使用习惯，iPhone14ProMax能用一整天，然后次日上午10点左右充电。整体上，这款手机在我手里，基本是一天多充一次电，普通手机做不到这样。，非常好
78,外形外观：很好，难道手里感觉不错。屏幕音效：屏幕很有质感，比普通的手机强。拍照效果：拍照杠杠的！运行速度：运行非常快
79,外形外观：很好看，看着很大气 。屏幕音效：声音很响亮 很清晰  听着很不错   有沉浸感拍照效果：拍照不用多说 很无敌的存在运行速度：a16芯片无敌待机时间：很长 能用一天
80,屏幕音效：非常好 非常喜欢拍照效果：爱死原相机了好漂亮运行速度：运行速度很顺畅待机时间：待机时长非常nice
81,物流非常给力昨天买的，今天就到了运行速度：操作系统很流畅，不卡顿，非常好用待机时间：待机时间很长喜欢外形外观：外观简洁明了，金属质感不错，抓在手机手感非常不错，大爱喜欢。
82,届蛋过业登量同样增加，待机时间真的很长，日常使用一天充一次都用不完，这款新出的苹果手机质量很好，系统流畅，信号稳定，手感很好，磨砂的外壳手感挺好的，金属的边框坚硬结实，屏幕分辨率比较高，拍照清楚，显示艳丽，外观新颖，质量可靠，很快就收到了。手机太完美了，而且屏幕很清晰，色彩鲜艳，运行運度也很快，音质也很不错 主要相机提升很大，拍照很提升很大特别是raw，续航还没有试，手感比以上版本系列要高，运行速度很快，尤其打开程序时反重添里亚信P上2，旦延思记合业网街公2，何能时间真的很长，日常使用一天充一次都用不完，这款新出的苹果手机质量很好，系统流畅，信号稳定，手感很好，磨砂的外壳手感挺好的，金属的边框坚硬结实，屏幕分辨率比较高，拍照清楚，显示艳丽，外观新颖，质量可靠，很快就收到了。手机太完美了，而且屏幕很清晰，色彩鲜艳，运行速度也很快，音质也很不错 主要相机提升很大，拍照很提升很大特别是raw，续航还没有试，手感此以上版本系列要高，运行速度很快，尤其打开程序时反应很快，续航提升，屏幕提升，拍照大提升。
83,外形外观：白色很好看其他特色：系统就不说了非常的流畅拍照效果：很清晰，视频效果很好运行速度：响应速度很快屏幕音效：屏幕显示很清晰。
84,外形外观：新潮，手感很好，外观设计风格非常好看的屏幕音效：音效也是一流的，一如既往，没有失望拍照效果：拍照一流
85,外形外观：时尚大气屏幕音效：色彩缤纷、音质极佳拍照效果：拍照当然杠杠的运行速度：快的飞起待机时间：玩一天没压力
86,种草很久的手机 用起来很流畅 超级顺滑 适应了苹果的系统 换别的不适应 电池这次很惊讶 比想象的好不少 不用每天两充了呵呵
87,外形外观：手机外观很潮屏幕音效：音效很清晰，听音乐很入耳，立体声效果很赞拍照效果：效果清晰可见，运行速度：还可以待机时间：非常棒其他特色：特色吗赞赞赞
88,速度好快，头一天就到了，这次特意买了大内存的，大品牌就是好，用起来很流畅，运行速度很快，拍照效果也很好，银色真是绝绝子，特别高级。
89,外形外观：暗夜紫配色高大上屏幕音效：音响很棒，屏幕也是顶级的拍照效果：顶级运行速度：相当快待机时间：待机时间超长，可以用一天
90,手机不错，用起来很流畅，运行速度很快，拍照效果也很好， Promax 大小刚刚好，黑色真是绝绝子，特别高级
91,之前手机内存不够用了，这次买了512G，够用好久了，开箱看到实物，银色真的超美，很干净的颜色，无法形容的美，超喜欢银色，也非常好搭配手机壳，手机非常的流畅，使用了一段时间，没有任何问题，拍照非常清晰，灵动岛有时候还是很实用的，手机一直在京东买的，物流服务一如即往的好，很满意。
92,外形外观：外观设计屏幕改为灵动岛，不过摄像头真的大屏幕音效：屏幕6.7寸的，音效可以拍照效果：拍照有高清拍摄。运行速度：运行速度很快，最新芯片
93,续航真的不要太顶，拍照对比上一代提升较大，灵动岛真的很有趣啊，期待后面适配软件越来越多。还有屏幕亮度在强光下真的很清晰，充电换了30w快充顶死我了！
94,不错，帮同事下的单，一直缺货盯了很久啦外形外观：外观没有瑕疵，暗紫色很漂亮运行速度：非常快，打游戏超级流畅！
95,京东官网购买 很放心，一直信赖京东，搞活动购买的 很划算，一直是果粉 已经换 第二台紫色了 ，手机像素问题 拍不出原色，拍出来??色差
96,第一次在实体店看到紫色iPhone14就被惊艳了，高端大气，太喜欢了！但这颜色到处缺货，好不容易才半夜在京东抢到，立感满满的小确幸！
97,外形外观：完美无瑕疵拍照效果：对焦各方面都不错待机时间：比苹果13长多了运行速度：不卡，极速阿
