numbers,comments
486,东西质量非常好，与卖家描述的完全一致，非常满意，真的很喜欢，完全超出期望值，发货速度非常快，包装非常仔细、严实，物流公司服务态度很好，运送速度很快，很满意的一次购物。
487,总体来说还是比较满意的外形外观：好看但是硌手屏幕音效：屏幕素质不错。双扬OK拍照效果：锐化有点严重 不过视频录制还是强的运行速度：快待机时间：没有问题
488,本人不崇洋媚外，再次在京东上购买苹果手机的主要原因还是因为它的流畅。家里其他手机都是各种型号的华为。        京东物流很快，隔天到达，包装完整。打开使用，屏幕够大，手感厚重。买的是512G的，装再多的app还是够用的，拍照像素高，视频也能多存储一些了。升级了系统，没有任何的卡顿，好评！        在京东的体验时好时差，电子产品一般都不错，有的小零食或小用品商品就不敢恭维了。
489,外形外观：很大气屏幕音效：流畅度够用，显示看着也舒服拍照效果：拍照广角和微距如图，感觉还可以运行速度：很快，而且后台运行不会卡顿待机时间：一天电都用不完（不玩游戏的前提下）其他特色：手机从山东调运来的，比较远；游戏还没测试，应该也可以，但苹果各个软件充值都有手续费（收商家或消费者），比如抖音就直接把成本嫁接在消费者身上
490,帮亲戚下单，iPhone 14 Pro Max金色也蛮好看的，自己也在用金色的，颜值担当，后续15Pro Max出来也会继续用金色版本
491,"外形外观：外观整体来说没有想象中的颜色那么好看最满意的是内存1T,终于不用天天删了，解决最主要的需求即可运行速度：很流畅，还是满意的啦，拿到新手机开心的，不过今天第一次摔了，外观已经磕碰了，建议拿到手还是尽快贴膜套壳哈哈哈"
492,以前都是iPhone直营店年年换新，疫情原因今年没换，从京东直接买，旧手机再回收，感觉还能更合适点，比较信赖京东，手机没啥说的了，设计精良，只不过新意是越来越低了，苹果有点黔驴技穷了
493,登岛成功，十分灵动iphone始终流畅如一，好用，性能充沛平稳不拖拉，屏幕是舒服。附上前两部的照片，目前仍在服役，尚能一用
494,外形外观：男生还是选黑色的，质感好，女生白色和金色都不错哦屏幕音效：屏幕音效：这个机器 LG的屏，高刷还是不错的拍照效果：这个拍照是真的不错，比安卓机强多了运行速度：一如既往的流畅待机时间：待机充电速度，这个比不过安卓机
495,外形外观：iPhone的外观没得说，很棒屏幕音效：120hz动态刷新外加苹果的调教，屏幕素质没话说。音效也很好，声音比较大。听歌也很好拍照效果：苹果的拍照一直就那样，但是录视频很不错。运行速度：无卡顿闪退，iOS流畅度不是盖的待机时间：早八到晚九，重度使用，还有20%的电其他特色：磨砂后盖很不错，但是这个直角边框外加不锈钢的，比较割手，带壳解决问题。之前就是14pm，这次只是换个颜色而已，之前的是紫色觉得不好看。总之没得说，很nice！ 京东到手直接查，摄像头无灰尘，边框无掉漆使用痕迹，原封未激活。
496,1、外观精致灵动岛设计吸引1眼球，这种设计是将前置摄像头和面容 1D 传感器等组件嵌入到机身中，并带来了新奇的交互功能，比传统的刘海设计好看太多了2、屏幕显示效果出色超视网膜 XDR 显示屏，具有出色的视觉效果和画面质量。该显示屏的分辨率为 2556x 1179 像素，能够呈现出更加细腻、清晰的图像和文本。3、性能强劲，运行流畅搭载了苹果 A16 仿生芯片，能够为用户提供更加流畅、稳定的使用体验。在日常使用中，能够让游戏和4、强大的拍摄能力视频等内容运行更加流畅、自然。该手机还支持 4K 视频拍摄，能够为用户提供更加清晰、细腻的视频录制体验。5.、续航时间长。
497,从安卓过来的，感觉很舒服，也没有系统用不习惯的情况外形外观：精致，就是不锈钢边框是真的指纹收集器屏幕音效：屏幕观感很棒拍照效果：拍照对我来说无所谓，平时也不拍照，效果挺好，原相机太真实运行速度：流畅，二月份用了小米13，可能流畅度想差不大，主要看使用时间了待机时间：正常一天一充（不打游戏的情况）其他特色：无
498,外形外观：以前用的黑色，新机买的白色，干净，大气，比较好买外壳运行速度：还行，不会卡顿待机时间：相对于苹果之前的机，算是有很大提升了，跟着Keep运动一小时，耗电5%左右
499,外形外观：比pro大一圈，真的超级沉手，比较适合男的用拍照效果：4800的像素，真的牛逼。但是内存得512起才行运行速度：比14要快一些待机时间：差不多能待机一整天吧，一天一充没问题其他特色：深空黑颜色真的好高级
500,外形外观：没话说，是心中理想型。屏幕音效：操作灵敏，高刷不是盖的。扬声器简直就是低音炮嘛，爱了。拍照效果：本人不怎么拍照，所以也不多做评价。运行速度：快，就是快。待机时间：基本上就一天一充。
501,外形外观：暗紫色犹豫过，拿到手就是真香屏幕音效：音效音质都有震撼到拍照效果：拍照没话说，比那些一亿两亿像素好太多啦运行速度：A16谁用谁知道待机时间：充满电全天，中度使用无压力
502,外形外观：大气屏幕音效：清晰，音效好拍照效果：清晰效果不错运行速度：流畅待机时间：待观察其他特色：霸气侧漏
503,还不错 有点大 单手不好操作 屏幕精致 续航也还行 就是键盘下边一大片空白看着难受  音响也差不多 没ipad音效好  四周没倒角  看起来觉得很厚 这个金色也很淡  总体还行吧
504,外形外观：紫色没有想象中的那么饱和度高。屏幕音效：和以前一样。拍照效果：切换焦距的时候会有顿挫感。运行速度：很快。待机时间：非常短。其他特色：摔不坏。
505,外形外观：外观风格没有大的变化，简约大气屏幕音效：比之前的XS Max要好很多拍照效果：白天照片拍出来效果不错，夜景是一贯的差运行速度：玩游戏有时会闪退总的来说，因为内存不够而换的手机，没有惊艳，信号一贯的不好，这个很影响使用
506,外形外观：外观还是中规中矩屏幕音效：音响效果很不错拍照效果：拍照像素我提高运行速度：不打游戏不太清楚待机时间：待机时间还可以其他特色：充电器买个快充充电速度就快一点了
507,外形外观：大气屏幕音效：牛气拍照效果：清晰明了运行速度：快速，但偶尔会卡待机时间：一般其他特色：色彩分明，但是散热还是太差。续航也不行，拍照还可以。
508,外形外观：喜欢  方方正正的拍照效果：日常拍视绝对够用运行速度：运行畅快IOS 没得说待机时间：待机时间挺长的，一天下来还有5   60
509,拍照清晰 运行畅快续航很好作为一台旗舰机，其性能我也不必多说，我就从使用体验讲讲吧。第一、通信信号质量的确不是最优；第二、搭配 20w 的适配器，对于当下重度使用手机的急性子我来说，不够快。不过，裸见摸起来手感很舒服。总体来说还不错，除了充电效率慢。
510,续航挺好，打了一把王者掉了2%电，用一天完全没问题，11换过来的，60跟120高刷好像区别不大，很流畅，大屏幕很好用，女生用起来也挺顺手的，就是有点重
511,使用了两个月，说下感受吧，续航蛮可以的，上班族不玩游戏，中午刷视频摸鱼，下班电量有60左右，忙起来的话待机不咋玩两天一充，游戏党的话要一天一充了，啥电池能顶住游戏造，拍照挺清楚的，挺重的，现在天气热了，放兜里有点沉，坠裆哈哈啊哈哈！目前没有什么毛病，有拍高品质vlog的可以入14promax，录制的4k60fps确实可以！评论有限，手机正品，放心入吧！
512,外形外观：白色机器颜色很好看，后盖磨砂材质不容易留下指纹，侧面不锈钢持握感不错，总之确实很好看。屏幕音效：屏幕显示效果细腻，色彩精准，刷新率也不错，公放音效对我也够用了，声音开大后的杂音感也控制得不错。拍照效果：总体来讲不错，尤其是拍视频确实在手机里第一。拍照片当然也不错，但晚上光线充足的地方拍照感觉色准有问题，淡蓝色的物体拍出来已经接近白色了，和肉眼观察实物相比差异较大，不知道白天会不会好点。运行速度：运转流畅，动画细腻，没啥好说的。
513,顶配走起，屏幕音效：立体音环绕外形外观：屏幕很大，金色淡淡的，没有土豪金的狂放拍照效果：拍照很逼真，苹果的巅峰之作，值得一看，就是价格太贵了。
514,运行流畅，屏幕显示清晰，运行速度快，待机时间：新手机待机时间久，比上一代重拍照效果：黑夜拍照强于上一代
515,京东自营正品有保障，外形外观：硬朗又不失优雅屏幕音效：这个机器的确很棒拍照效果：手机中的翘楚运行速度：封闭系统没得说待机时间：电池叫安卓机消耗的比较慢其他特色：手小的可以留意一下6.1
516,外形外观：一如既往都是大街样屏幕音效：可以没话说拍照效果：ok没问题运行速度：你懂的缺失苹果有实力待机时间：新机没问题够了一天正常使用
517,手机好用，价格实惠质量不错哦拍照效果：清晰明了运行速度：飞快待机时间：能用三天外形外观：好看，紫色的颜色时尚潮流休闲时尚
518,外形外观：这设置估计要沿用好几代，活动入手最好。屏幕音效：一直用iPhone手机，感觉不到什么大的变化，反正12时的绿屏也可以接受。14pro的屏是不错的。拍照效果：视频最好，拍照确实也过的去，毕竟都这价格，肯定是一流水准。
519,手机买了一段时间了，用起来很不错，再也没有之前的电量焦虑了、每天充电一次 可以支持到晚上睡觉，灵动岛功能很好玩，摄像镜头玩手机摄影完全足够了，唯一不足的地方就是太重了 每天拿着超过半斤重的手机 手很酸啊
520,外形外观：万年不变，实在是之前13promax内存不够，才换的屏幕音效：完美拍照效果：完美运行速度：完美待机时间：可以其他特色：配送一如既往的快，自营的品质还是有保证的，售后方便，就是保价7天有点短了，可以再长点
521,晚上下单，次日到手，外观真的不用多说，就是漂亮。金色不是很金，淡淡的，初时担心太金了不好看。手感好，音质、画质也可以，系统有点繁琐，自带的软件太多，音乐还送了半年会员。用了十几年国产，这是第一台苹果，但价格也是以往总和，不是有点优惠不会买。现在的国产机质量很好，但价格也不便宜。
522,这款手机，苹果的顶配，多的不说，方方面面都是很到位的，无须多言。但是依然有一些细节的问题不太好，第一是续航，之前就听说各代promax的续航很顶，但是我使用后发现，虽然很不错，但也没有网上吹嘘的那么强大、第二是信号，苹果信号向来都是大通病，pm也没法避免，但是相较于基础款以及前代产品还是有些许提升，甚至在某些场景的信号也不逊色于安卓机
523,外形外观：祖传的外表一直没变，灵动岛一般般屏幕音效：还是一如既往地一般般拍照效果：还行还行运行速度：这个一直领先
524,外形外观：一只手拿着，手感刚刚好，紫气看起来大气！屏幕音效：音效好，屏幕触控灵敏，屏幕分辨率高，值得拥有
525,手机很流畅，但是感觉5g网络也不是很快，一直都是用的苹果，本来想等15的，但是之前那个手机坏了用不了了，所以就只有买这款了，拍照还是算清晰
526,用了一个星期左右，没啥问题，感觉挺好的。配了手机外売，配合得挺好。功能与原来没啥区别，好像有个悬浮功能，差别不大吧。
527,外形外观：不错屏幕音效：可以拍照效果：合适运行速度：目前还可以待机时间：够用现在送货是越来越快了，下单半小时左右就到了，厉害啊。把手上旧机器升级，用个2年新机了。希望可以恰到好处。
528,手机不错，就是有点小瑕疵，待机手机挺长的，手机经常用的就是那几个功能，目前还行，不过还是有点掉漆，明明戴着手机壳的。
529,苹果手机一如既往的好，就是太重了，处理器杠杠的外形外观：选的紫色外观，新配色屏幕音效：音效绝对是一流的
530,外形外观：挺好的跟我原来的手机一样大，就是插卡那里摸起来有一点硌手，我是从安卓转过来准备试一下苹果的，屏幕很好，拍照效果跟我的米10u差不多，过度动画很丝滑，特别是待机时间真的有点顶，不知道后续会咋样，总体来说还是可以的
531,原来用的7 P实在跑不动了，换了苹果14PMAX256带充电头的套装。这段时间用下来，感觉还可以，够流畅，又可以对付几年了。
532,用几天了 ，目前还没有什么问题。手感挺好的，手机挺重的，挺大的还好我手够大，手小的建议选pro吧手感合适 。
533,新款暗黑紫太好看了，这个颜色男女通用没问题，做工手感还是苹果最好，这次功能又添加了个灵动岛，不知道好用不好用，这款的打摄像头太霸气了，?
534,老婆去年就说喜欢三个眼睛的手机，但不知道是苹果，清明节那天满足了她的要求，用了三天了很喜欢，带壳称重283g，有份量反而能拿上手，系统流畅。
535,怎么说呢，接近1个w的手机确实挺肉疼的，不过咬咬牙还是下了单，手机的11也该退场了，其实也纠结过三星23，最终还是选择了这一款，毕竟iOS用着更省心，也更持久。手机分量很足，比较压手，不锈钢边框看着很高级，三个硕大的摄像头也挺震惊的，比11的大太多了。至于拍照效果还有什么高刷屏幕就是见仁见智了。总之还是相信iPhone，相信京东。
536,外观大气，颜值担当，对于女子的手来说，太重，虽然重，但还是选择了PM，屏幕大， 续航能力强，还有那4800万&hellip;&hellip;
537,手机已经收到了，包装完好，都非常流畅，手感舒适，外观蛮好看的，质量好好的，通过苹果官方激活手机使用，事实证明是正货，放心购买使用
538,"因为我有一台IPad,，这次也没有什么惊喜，用起来感觉可以，本人不玩游戏，电池觉得早晨充满，晚上还有百分之40多。"
539,机皇依然没的说，不愧机皇的称号，一点都不卡顿，屏幕大，在外面使用仍然能看清屏幕，峰值亮度确实高，不得不说苹果最高机型确实厉害
540,银色外观真的好看，这代的屏幕设计挺新颖，实用性和互动性都挺强，拍照效果挺满意，系统流畅度和续航也不错，自营送货快服务也可以。
541,这款拿着确实大些，机身轻薄暗紫色质感也好，运行很流畅拍照挺给力，电池续航时间长，各方面体验都挺不错的！
542,运行速度：A16的芯片就不用说了，地球最强手机芯片！待机时间：比上一代的iPhone强一点！外形外观：反正在我看来和前代没有什么区别！
543,京东商城的商品可以，正品保证，外观没有瑕疵，拍照效果不错，运行速度，手机的待机时间一整天都没问题，没有电量焦虑，就是手感有点重，
544,从京东自营的平台上挑选了这款iPhone 14promax，这次刻意挑选了紫色的。这款手机整体上符合预期，从待机到运行速度上，都有一定的提升，感觉不错，好评！
545,确实是一分钱一分货，质量肯定是过得去的，色彩外观都是颜值担当，资深苹果粉，一直都在用这个牌子，比较靠谱，也用的习惯了，所以换了原来的旧机子，用这个新果，贵是贵了点，忍痛狠心买了这一台，还是期待机子耐用好用
546,这款Apple iPhone 14 Pro Max (A2896) 512GB 银色 支持移动联通电信5G 双卡双待手机，老是没货，偶尔放出几台一会儿就抢完，好不容易才抢到。京东物流很快，第二天拿到了，够大，就是沉，这突出的镜头也不知道该不该贴膜。
547,换机走起，14promax还是香的，主要续航也好，紫色离开灯光就没那么亮的，跟另一台13时的远峰蓝嗨挺配的，支持购买。
548,买给家人的，一下买了两台，给家里人都换一下手机，苹果的使用没的说，一直也都用，也用习惯了，系统流畅，就是价格实在是太贵了，每次换手机都是大出血啊，希望新手机电池续航给力点，能多用几年吧～
549,第一次使用苹果，用惯了三星，还有点不习惯，手机外观精致，屏幕显示细腻，使用功能还待慢慢学习，值得入手。
550,二月情人节前买的，搞活动12期买的，貌似之后酒一直没有搞过这种活动。。苹果系统比安卓简洁，确实不错，使用了一段时间流畅方便，颜色够亮。。。。
551,包装完好，手机无使用痕迹，边框严丝合缝，屏幕无阴阳屏无坏点，一次完美下车，高刷的屏幕用起来真的丝滑无比，但是高光调频对我的眼睛来说还是负担，还好不是我用的，无福消受
552,刚好之前的手机屏幕坏了，就换了这款，挺好用的，特别是拍照功能进步很大，目前电池续航还行，以后肯定慢慢会下降。
553,快递小哥很给力，次日达。信号?及Wifi网络这一块一直是苹果手机的祖传通病。从未优化过。但电池续航有所提升外观手感一般，灵动岛还没玩透感觉鸡肋。操作反应速度是没得说的。
554,这个颜色真的好看，适合女孩子，本来想等15的，奈何13内屏摔了，不想修了，入手一台14，颜色好看啊，其他方面用过再来追评
555,手机是正品，就是买了两天就减价了
556,从12 13 到14promax一直都是在京东购买的，现在优惠800块钱，次日就到货了。手机外观都好好，各种序列号都查过了。银色果然是yyds，好漂亮的白色，好好看，放弃了金色果然是对的。
557,苹果的出品还是一如既往的好这个系列最大的变化是增加了灵动岛 虽然我觉得也没啥 但是还算是个小创新然后就是拍照的像素有了显著的提升 这就很厉害了
558,家人用的老iPhone都需要换了，狠狠心一下买了两部都给换了，虽然苹果的手机用起来很不错，系统也流畅方便，但就是价格实在是太贵了，希望新手机使用完美吧，电池也希望耐用一点
559,iPhone14pro Max，256G，拿到手还是比较满意的，运行速度快，最主要的是拍照确实像素高，还是比较满意的，赞一个。
560,一直使用苹果手机，这次买了深邃黑，YYDS ?清晰度没得说，非常好，音效也不错，4800万像素太赞了。苹果手机的速度没有任何一款手机可比，带电还可以，充电非常快，信号比之前的XR 要好很多，就是有个别时候用不多久手机有些发热，联系了售后，他说后续系统更新会好的，希望快点好
561,赶上京东补贴，到手还是比较划算的，金色的配色很漂亮，256的存储很合适，max拿在手上还是稍稍有点重。
562,心心念念的手机终于收到了，真不错颜色也是我喜欢的好看的商品真是给力用几年再换嘿嘿嘿不错哟产品来买吧续航也不错的
563,双十一买的iPhone14 pro，用了朋友的pro max感觉真香，春节果断再买一台，系统流畅、屏幕清晰细腻，不愧是业界领先
564,老婆以前最早用了4后就一直用国产机，一直出现故障，卡顿等情况，所以现在又想换回用iPhone了，为了让老婆体验最好的，所以就买了这个por max，满足了老婆要求的大屏幕。感谢京东的速度，第一天下单，第二天就到了，点赞！??
565,从12换过来的！还是流畅～期待15是什么样子了～拍照效果：很不错～虽然变焦没有那么猛但是日常已经非常够用了！
566,买苹果还是得京东啊，货有保证，当然拆包的时候，最好还是全程视频更放心些，对于产品本身而言，不必多说，喜欢的就是喜欢的，京东可以分期这个蛮好
567,用苹果产品已经快二十年了。这次从X升级到14 pro感觉变化还是挺大的。灵动岛挺有意思，功能还在继续摸索中。期待下次升级。
568,用了4年华为现在又转回iPhone，主要原因是因为iPhone相机的色彩还原度更高。入手14PM是看中其电池的续航能力，但代价是重量，比之前的华为P30重不少，慢慢习惯中。京东自营店下单次日达，价格有800元优惠，比实体店更便利。
569,挺好的手机。就是贵。没有别的缺点。百亿补贴没买到。但是买的时候也算是优惠。还可以吧。挺好的。等到iPhone 18了再换手机。信号问题依然很大。要是解决不了就不换了。
570,手机一直都是在京东上买的，没有翻车过，用了一段时间觉得还是不错的。手机的大小习惯揣在兜里的，尺寸会有些大，其它都没有什么。
571,正好这几天京东自营有优惠活动，上午下单，下午就到，对京东物流点赞。同时这款手机算是机皇了，运行块显示好，就是我的敢爱。自营的正品行货。
572,安卓手机用了好几年，换苹果手机，喜欢大屏幕，还是觉得14pm和我心意，买了以后检查没有毛病，京东自营的我还是放心相信，满意的购物体验
573,苹果手机除了价格偏贵以外，其他没有什么问题，随便一部手机用个五六年没有什么问题，确实皮实，只是现在的电池不像之前的老款耐用，基本上每天都要充电，不过好在不会卡顿，确实不错。
574,iPhone  14 PRO max 永恒的经典，简洁大方，值得购买，电子产品的缺点就是更新换代太快了
575,就是喜欢，就是买，第四款苹果了，从4到，六，到8，再到14，都是历程啊，怎么说呢，苹果手机就是那么顺手，就是爱不释手，嘿嘿嘿
576,记不清第几次在东哥家购买iphone了，整体不错，安全下车。没有其他买家反应的问题，可能运气不错，反馈谨代表个例，希望大家都好运。
577,外形外观：不用说屏幕音效：还行拍照效果：4800万运行速度：666待机时间：持久其他特色：就是手机壳有点小贵，但是，还是买了。很好的手感，不用担心变黄
578,以前一直在苹果手机官网买手机，自己先买了个14primax512G的，这次又给上大学的侄子买了个256G的苹果14promax，下午下单，第二天中午就从西安仓库发货送过来了，与我先前半个月买的比，觉得手机电池耗电有些快，其他暂时没有发现问题，用一段时间再追评，谢谢京东！
579,我打心里觉得苹果一般情况，但是老婆想要就买了，我觉得速度也挺快的，我觉得跟我的mate40pro差不多，拍照也挺不错的，新手机电池确实比我的旧手机用的时间长。
580,物流非常快，当天上午下的单，下午就到手上了，灵动岛的设计很新奇，系统也是一如既往地流畅，不吹不黑除了价格略贵，其他的都是没话说。。。。。
581,京东物流配送还是一如既往地快得没话说了。收到货用了几天，苹果还是不愧苹果，用起来感觉还是不错的，比那些还是好了几条街。
582,物流挺快的，下单没多久就到了，手机是我老公在用，我只是来评价一下，貌似他用着效果好像还不错，没有听说有什么问题，就是什么时候能给价格打下来哈哈哈
583,这个手机是买来送宝宝的！！我宝非常喜欢，不过这和上一代用起来着实没什么差别，1.3万的价格确实是太贵了啦，能用五年吧，先用着。
584,国行正品，自营还是值得信赖的，想买这款手机好久了，但是囊中羞涩，好在现在降价了，想要的小伙伴赶快入手，感觉15没什么亮点了
585,京东自营店，还是值得信赖的，送人的，所以使用着拍不了手机，随便拍个配图。华为加油?希望华为5G快点回归，不买水果了
586,晚上下单早上就收到了，非常快。京东品质物流值得信赖。苹果手机各方面性能都不错，要说缺点那就是比一般手机贵点。花钱都是买享受，??
