numbers,comments
943,京东物流非常快，赶上活动还能12期免息分期，非常划算。机器没得说手机里最强的，无论屏幕显示、摄像功能都非常完美，爱不释手。
944,外形外观：14的外观还是不错的，很美观屏幕音效：屏幕很顶级的，音效很好拍照效果：拍照一直是强项，画质很好运行速度：运行速度很好，不会有卡顿感待机时间：待机时间是很好的，续航有提升的其他特色：苹果的手机，系统流畅性是没有什么可挑剔的！可以入手的！
945,外形外观：外观美观大气 清新脱俗屏幕音效：音效效果特别好 清晰明了拍照效果：拍照特别清晰 像素非常高运行速度：运行速度特别快
946,正品，金色的非常帅气，做工精致，赶上京东优惠，性价比还不错，灵动岛的确增加了手机的交互性，赋予手机新的交互方式方式，很新奇。京东物流也非常给力，送货速度快！
947,外形外观：金色很吸晴。屏幕音效：双扬声器效果很棒拍照效果：4800万比1200万有进步运行速度：偶尔卡顿待机时间：比13ProMax差
948,超级完美，老妈过生日送给礼物，10:50下单，下午4点多就送到了！紫色很漂亮！大屏幕很爽，512g对于老人应该也够了，用着放心，最喜欢的还是苹果手机之间传输数据，不到40分钟新手机就复制好了，真是不错
949,外形外观：设计流畅线条搭配好屏幕音效：低音效果突出。拍照效果：清晰明了。运行速度：超级快，不卡顿。。
950,不愧是机皇！运行畅快 拍照清晰 续航很好!确实香，各方面都不错，灵动岛还是很有意思的，续航非常的好，5g也挺快的，
951,外形外观：暗紫色的配色，手机颜色真的很好看。屏幕音效：6.7寸的屏幕，音质音效非常好听音乐真的好。拍照效果：苹果全面提升的拍照，效果很棒。运行速度：苹果A16芯片运行非常流畅没有卡顿。待机时间：待机时间长。其他特色：灵动岛很好用。
952,用了两天了，系统流利，续航时间长，定位准确，准确的定位对爱跑步的我来说非常重要，而且喜欢这个重量，拿在手里有感觉。
953,买大件还得是京东自营，买的放心，已经用了一段时间了，新手机就是好用啊，速度超级快，照片视频太多了，买的1T的，这样就不怕照片占空间了，深紫色很好看！
954,外形外观：经典iPhone造型，max适合玩游戏看电影屏幕音效：适合游戏 电影 视频拍照效果：一如既往的苹果的效果，原片很出色，真实运行速度：流畅、ios的优势
955,外形外观：Pro Max实际还是比Pro大不少，一只手不太方便，感觉买pro更合适些屏幕音效：感觉自带音响效果拍照效果：拍照太清晰了运行速度：速度超快毫无卡顿
956,运行速度：非常快，没有一点卡顿，很好用屏幕音效：屏幕显示非常漂亮拍照效果：拍照非常自然真实，不会美颜过度外形外观：完美！！
957,比之前用的都顶，这个算是我用过的手机中待机方面最好的了，背面一如既往的经典设计，银色也很耐看，正面灵动岛也很有新鲜感，就是手机重量越来越重了，屏幕显示效果很好，色彩鲜艳准确，120Hz流畅度很高，外放音乐也很不错。
958,这个产品和它价位相比来说，还是很合适的东西已经收到！手感不错！用料扎实！质量很好！平常用基本没有问题！宝贝收到了，质量很不错，包装精致，材质优秀，比想象中好，送礼自用非常合适，下次继续购买
959,外形外观：好看屏幕音效：清晰拍照效果：分辨率高运行速度：飞快待机时间：很长其他特色：都很好。
960,一般和13没有什么区别
961,用起来挺好，流畅顺滑，拍照效果更是没得说外形外观：好看大气我喜欢屏幕音效：用了多年，一直喜欢，音效没得说，环绕声拍照效果：拍照调校好了后，真的很给力运行速度：iOS没得说，一直都很好的
962,外形外观：挺好看的，比较厚，电量经用屏幕音效：屏幕很舒服，音效特别好。拍照效果：非常舒服，有点相机那味儿了。运行速度：挺快的。待机时间：一天用不完。
963,手机换了一次，第一次碰见程序问题，照相机死机，键盘不出来等问题。后面经过协调换过一次，安全下车。电池续航真的很棒，一天都不用充电，拍照也很清晰。
964,外形外观：想象中的样子，磨砂玻璃屏屏幕音效：挺好，悦耳动听拍照效果：视频特别清晰，感觉是行走的照片运行速度：很快，不卡了
965,屏幕音效：很完美，苹果4就开始用了，隔3年换一款外形外观：很满意，很完美拍照效果：很好，喜欢，高品质，很清晰。运行速度：飞一样的感觉，哈哈，很满意
966,全新机，手感很好，比我想象的要好，打游戏也很流畅，比我现在的12好太多了，256内存，也不怕不够用。
967,外形外观：外观很惊艳，看着感觉很高级，很喜欢的款式，用着感觉也不错。暗夜紫真的是决绝子！屏幕音效：音质一级棒，屏幕也超级清晰，用一段时间再用别的手机就能感受到差别了！拍照效果：拍照很清晰，放大也不失真，感觉拍照拍的很真实，这是别的手机达不到的效果，就是感觉相当满意！运行速度：运行速度很快，超越别的所有手机，水果手机的特点大家都知道那就是系统，系统丝滑流畅。
968,手机质感还是很不错的，外观没有瑕疵，倒存数据也比较方便，开机运行比较流畅，外观也是自己喜欢的款式，分辨率较高，拍照，看电视都很不错
969,外形外观：方方正正！很好看屏幕音效：很好！新引拍照效果：特别清晰，苹果手机就没拍照差的，但对比以前的旧版，这版当然要好很多，还有广角镜头运行速度：很流畅
970,外形外观：好看超级耐看哼喜欢屏幕音效：很好的音效听起来很有立体感拍照效果：拍照真的内存超级大一张照片运行速度：运行不用说苹果的无敌
971,外形外观：暗夜紫实际到手的手感非常的nice屏幕音效：环绕音响一如既往拍照效果：一直都很喜欢p系列的摄像头运行速度：丝滑待机时间：超长
972,多年不用苹果了，都有些生疏了，又一次使用，入手手感超级棒，屏幕很清晰，拍照视觉很美，有些还是摸不着头脑，慢慢接着去摸索，京东发货速度确实快，用了一下午了，手机续航也挺好
973,外形外观：经典的外观加上亮眼的金属边框非常帅气屏幕音效：很好拍照效果：很好运行速度：很快待机时间：很长其他特色：就是信号有待改善还有屏幕没三星手机舒服
974,这款新出的苹果手机质量很好，颜色好看，系统流畅，信号稳定，磨砂的外壳手感好，屏幕分辨率高，拍照清晰，屏幕大操作方便，货真价实，高品质，值得购买
975,iphone 14promax很大一个，自重蛮厉害的，给老公买的，他很喜欢。黑色蛮帅气的，外观手感很棒，待电续航能力还不错，就是没啥折扣入手的，价格有点高，买完一个月就降价了。配送速度很快，服务保障也很OK，总体还是满意的！
976,外形外观：没有任何理由不说好看屏幕音效：天花板没有什么好说的拍照效果：效果杠杠的，拍出来美美的运行速度：快，最流畅的系统
977,夜问模式曝光速度提升两倍。昨晚下单，今天很快发货啦，手感很好，黑色的。然后运行方面流畅了许多，丝滑的感觉，简直完美！还是一如既往的简洁大气！，相机不是提升一点半点，摄像头也大了很多，哈哈，很不错。这个手机用料就是扎实，拿在手上的手感很好，很重，是我喜欢的。
978,京东快递超快，好看收到快递，晚上下单第二天送到外形外观：苹果没说的??????线条流畅完美屏幕音效：在太阳光下也看到超清晰，本来苹果强项拍照效果：4800万像素，超大光圈，堪比专业相机运行速度：iOS快，
979,还可以，老苹果机主，没啥太大的体验，灵动岛也不出奇，因个新机流畅，还是满意的，超级好看超级超级好看，续航不是太好！
980,好评，?赶上元宵节做活动的时候买的，优惠劵优惠力度大，感觉买值了，还有物流超级快，点赞！?从没想过这么实惠的价格，?能买到这么好的宝贝，?性价比非常高，我很喜欢哦?，商品质量好，总之就是很赞了，非常的赞，我很喜欢，还会再来买的，原来买的苹果PRO屏幕太小了，这次从新换的新手机，上手快，很好?
981,iphone14pro max 不仅因为它的外观更加时尚，而且它的处理器更加强悍，可以提供更快的加载和更流畅的运行体验。它还具有更快的无线速度和更强大的电池续航能力，可以满足用户的日常使用需求。而且，它支持5G网络和更高的分辨率显示器，可以更好地完成用户的工作任务，可以说是最新智能手机中的一款最出色的机型。
982,外形外观：太大气了，屏幕尺寸非常满意，拿出去非常有面子。屏幕音效：屏幕非常清晰，音效也很好。拍照效果：清晰，并且自带美颜。运行速度：目前游戏无任何卡顿。待机时间：充满可用一天。其他特色：物流速度太快啦！
983,外形外观：很大很沉，用惯小屏手机的可能会不太习惯。屏幕音效：旗舰级别的，苹果品质都懂的。拍照效果：第一流！绝对的！运行速度：想不出还有别的手机会超过。待机时间：最长的之一，超过的应该很少了。其他特色：镜头有点太突兀了，收一点就好了。
984,外形外观：一直用pro，可是最近感觉小屏幕眼睛很累，就果断换了max，视觉非常舒服。屏幕音效：依然很丝滑拍照效果：很好。
985,真价实，高颜值，高品质，一分钱一分货，手机真的太有质感了，外观设计漂亮大方，手机屏幕大，刷视频和看电影
986,外形外观：超级好看，特别大气拍照效果：超级清晰，自带美颜运行速度：很快的其他特色：热爱的事情就要做到极致，值了??大爱?
987,到手第一时间就检查手机外观有没有刮花以及摄像头有没有灰尘，还有网上说的那些手机前摄像头上面缝隙很大啥的，很幸运，这些通通都没有! ! !总而言之，算是完美上岛啦!爱了爱了，开心^0^
988,手机很好看，很喜欢，非常值得购买，电池很大，也很耐用，屏幕观感也很好，亮度很好，也不怎么烫，玩游戏也很爽，画质很高，非常的流畅，屏幕也很大，很爽！
989,用起来非常的好，系统流畅无广告，无不可卸载的垃圾软件，干净安全，续航给力，不是某些吹牛的营销公司产品可以比的，手机还是苹果好用。
990,苹果手机，手机产品中目前的旗舰，给公司销售同事配的，这次买来好几个，都是找有优惠的买的，希望同事们喜欢就好，京东快递，发货速度很快，隔天就到，五星好评！
991,从iPhone 13换的iPhone 14 Pro max。新机给我的体验特别惊艳，是目前最好的手机毋庸置疑！！各种功能与硬件都是最好的，平常使用也特别流畅不起热。好评，值得推荐！！
992,金色外观还是很有质感的，之前一直用黑色，这次的金色淡淡的，很好看，屏幕显示效果很好，灵动岛开始还是挺有意思的，拍照和视频简直太棒了，清晰度和防抖都很好，基本上早上充满可以用一天
993,京东买电子产品很方便，也很放心，终于用上了，很流畅，信号也比前面几代好一点，屏幕大、分辨率高，看着不累眼睛，电量也很给力，频繁玩的情况下一天一充完全够
994,外形外观：没啥变化，刘海变药丸。屏幕音效：一直不错。拍照效果：一级棒。运行速度：杠杠滴。待机时间：待机时间：水果的特长。其他特色：除了满意还是满意。
995,品质不错，没的说，没的说外形外观：帅气漂亮屏幕音效：品质不错拍照效果：必须可以操作带感，质量很好，低调奢华有内涵
996,从12代promax更新到14代promax 体验太好了 有很直观的提升 120hz的刷新率看着确实舒服 回过头来看60hz确实感觉回不去了 人脸识别 打开软件的速度也很快 太好用了
997,这手机是送给闺女的生日礼物，手机外观很好看，屏幕音效好，主要是拍照效果非常不错，待机时间也很长，闺女很喜欢。
998,心动这款手机很久了，可惜一直没有货，这次终于入手两，体验下来，非常棒。之前用的iPhone12，使用了两年半左右，手机运行起来依旧流畅，只是电池不耐用了。这次换来一款大的，期望可以多用几年。
999,给太太换的手机，京东还是一贯的可靠。买回来使用没问题，手感也很好，自己配了个粉色的壳子。新手机从外形屏幕音效拍照都很好，太太很喜欢。
1000,等了很久才有货，不需要抢就买到了，京东一如既往的给力，拿到用了一段时间才来评论，比我之前的流畅很多，屏幕大、分辨率高，电板容量大，用起来很爽，夸一句丝滑不为过，很赞的手机，值得购买
1001,外形外观：手机外观时尚，尺寸大小中规中矩，到手握着也不费力屏幕音效：屏幕清晰，且不刺眼，6.1寸大小刚刚合适，音效也非常好，清晰浑厚没有杂音拍照效果：拍出来的效果就是实物，很清晰运行速度：丝滑流畅，没有卡顿待机时间：可以轻松玩一天
1002,外形外观：iPhone14整体效果和做工还是一如既往的好屏幕音效：屏幕音效声音非常清脆拍照效果：拍照效果比上一代有一定的提升还是不错的运行速度：运行速度快多了 提升了待机时间：整体待机效果还是可以的，最起码打游戏待机还是很给力&hellip;爆赞
1003,老婆直播安卓手机不清晰，要换手机，一狠心给她换了苹果手机，效果确实不错，流畅不卡顿，贵有贵的道理，她很喜欢蓝色的，使用几天下来挺好！值得购买！
1004,外形外观：外观无可挑剔，非常棒，做工极其精细，手感一流。屏幕音效：完全的直屏，非常不错，贴膜效果很好拍照效果：拍照清晰，很有真实感运行速度：运营流畅，从无卡顿不足之处：信号有点差。
1005,外形外观：外观简单大气上档次，很喜欢苹果的手感屏幕音效：音效很好，听着很舒服 没有杂音拍照效果：拍照非常的真皮，不失真，分辨率非常的高，，运行速度：运行很快，游戏都是秒开的，，同时开几个软件都不卡，物流很快
1006,挺流畅的 不过最近充电发热严重 通病吧产品质量，客服服务态度特别好，很喜欢，好评jisoo金智秀Jennie妮rose朴彩英Lisa莎小卡
1007,黄色是刚出来的价格也比较合适，大概5400买的，京东送货，一如既往的快，目前使用没有发现任何问题，黄色非常的亮眼都不用带壳
1008,新14，屏幕合适，边缘也窄外形外观：后面板贼舒服，整体好评屏幕音效：屏幕显示很细腻，比11的lcd屏幕好太多了拍照效果：好，挺好的，够用就可以啦，运行速度：快的呢
1009,手机收到使用一段时间后来评论的外形外观：黑色很耐看屏幕音效：屏幕适合  音效极佳运行速度：快待机时间：电量?很耐用  整体使用下来的感觉很好  家里人也使用的这款  区别只在于内存大小  没有卡顿的现象  运行很快  值得推荐
1010,非常非常非常赞，速度快，直接爱不释手，拍照效果：拍照很清晰外形外观：拿着舒服，舒适运行速度：很快，玩游戏一点都不卡
1011,"外型非常时尚,很漂亮，好品质、好服务，送货师傅很负责，态度很好，质量非常不错，使用无噪音，超级静音，太喜欢了谢谢，看起来用料做工不错，态度很好。我会再次拜访好卖家，专业的服务，细致的操作，之前也是在京东卖的，买了没有后悔，液晶控制面板也很高级，功能丰富，材质做工非常好，很喜欢。使用起来也很给力。大爱，目前没有任何问题，奈斯哦，有机会我还会再来的呵呵"
1012,已经不记得这是买了第几部苹果手机了，家里盒子都一大堆了。iPhone 14手机好用没的说，之前用Promax比较多，是真的重，这个手感正好，续航也非常我满意，拍照也很不错，虽然我就是拍拍风景，苹果手机的相片拍出来是最清晰自然的，还有人像模式特别好用。运行速度飞起，处理器不是盖的。
1013,手机很好看，拍照效果：不错运行速度：也挺快待机时间：刚开始用，还没有太大感觉手机在拍照，拍个充电器算了
1014,京东自营物流速度非常快早上10点下单，下午6点多就收到货了。在京东已经买了七八个手机了。京东购物值得信赖外形外观:延续前两代直角不锈钢边框设计，新的暗紫色也很有高级感。摄像头升级明显，镜头比上上一代更大了，整机手感依然非常好。屏幕音效:苹果手机屏幕是手机屏幕里显示效果最好的。这次屏幕户外强光下屏幕峰值亮度提高到了2000尼特。这个峰值亮度即使在非常强的阳光下使用，也能看的非常清楚。音质比上一代也有明显提升，声音洪亮立体声效果好。拍照效果:拍照也是苹果的强项，摄像头首次升级到4800万像素，更大的光圈。A16仿生芯片的加持。夜间拍照相比上一代噪点更少，拍出来的照片更清晰细节更丰富。白天拍照拍视频提升明显，已经接近专业相机的水准了。运行速度:A16芯片领先友商3-5年。无论玩大型游戏，还是平时使用都非常丝滑流畅，系统升级几代都没有卡顿现象。待机时间:虽然电池容量没有增加，得益于 A16芯片加持功耗更低。中度使用一整天。一天一充。重度使用8小时左右其他特色:iOS系统依然是手机系统最好用的，没有广告安全可靠UI设计看着舒服， iOS16首次加入了自定义锁屏，可以根据自己喜好自定义
1015,商品收到咯，特别喜欢，一收到就迫不及待地打开了，家人也很满意，这次购物体验不错性价比非常高?，可以放心购买?，做工非常精致?，值得购买?！
1016,包装上有污渍，不过应该是没开过封的，外形外观：外观一如既往，还是喜欢白色。屏幕音效：除了没高刷，别的没毛病拍照效果：比iPhone13强一些吧运行速度：比iPhone13多了2G运存，效果立竿见影。
1017,配送很快，外包装保护依然的很京东，有空气泡棉手机外壳脚都被搞瘪，手机使用还不错。手机信号比起以前好很多，在8那糟糕的信号用了三月就很多年没用苹果手机了。这14信号方面提高不少，特别使用联通卡。电量方面还行。
1018,用了一段时间了，相比于安卓来说信号是会差很多，而且安卓的一些人性化设置 iPhone没有。不过拍照确实很清晰，白色yyds！
1019,挺不错的，虽然没赶上活动的时候购入，但是也算可以了，毕竟急用，如果不是急用的朋友，可以等有活动的时候入手，就比较实惠啦
1020,手机发烫信号差??电消耗的也挺快
1021,很不错的体验，自定义屏保色彩很nice！外形外观：蓝色无论裸机还套透明壳都很好看屏幕音效：清晰拍照效果：很赞待机时间：一整天完全够用。运行速度：很酷
1022,这款Apple iPhone 14 (A2884) 128GB蓝色手机是一款功能强大、外观精美的高端智能手机。它具备多项优秀的功能和性能，能够满足用户各种需求。首先，该手机支持移动、联通、电信三大运营商的5G网络，让您可以随时随地畅快上网，无论是下载、浏览网页还是观看视频都更加流畅。而且，它还支持双卡双待功能，让您可以同时使用两张SIM卡，非常方便。其次，该手机拥有128GB的存储容量，可以存储大量的照片、视频、音乐等文件。而且，它还采用了先进的A系列芯片，拥有更加快速的运行速度和更加流畅的用户体验。此外，该手机还采用了一块6.1英寸的高清屏幕，分辨率达到2532&times;1170像素，色彩鲜艳、清晰度高、观感舒适。同时，它的摄像头也非常出色，后置摄像头为1200万像素+1200万像素双摄像头，前置摄像头为1200万像素，让您能够拍摄出清晰、美丽的照片和视频。总的来说，这款Apple iPhone 14 (A2884) 128GB蓝色手机是一款功能强大、外观精美的高端智能手机，拥有5G支持、双卡双待、128GB存储、A系列芯片、高清屏幕和高清摄像头等众多优秀特性。如果您正在寻找
1023,续航很好 拍照清晰 运行畅快。14支持自动对焦，即使在低亮度环境下也能实现较快的对焦，速度。后置依旧采用1200万像素广角/超广角双摄配置，全新的1200万像素主摄像头，传感器更大，单位像素达到1.9&mu;m，F/1.5光圈，传感器位移OIS，低光捕 获提高了49%。夜间模式曝光速度提升两倍。视频新增 运动防抖模式，动态拍摄更加稳定。用了快一个月，没有出现起热，卡顿的现象，对于我不玩游戏的人来说，14挺好的，刚开始买的时候看见评论，各种担心，用了一段时间后感觉很不错，屏幕非常细腻，很好，看上去非常舒服，比一般手机强多了，音效也很高，听歌很舒适，值得推荐。早买早享受！14拍照真的很好看！比13强太多啦，拍视频也绝绝子！而且电池的使用时间也比之前的机型要棒很多，因为不喜欢灵动岛，所以买了这个标准版，还是这个看起来顺眼。续航能力很好，拍照效果很清晰，运行速度很畅快，非常不错，午夜色比较清晰靓丽，外形外观，没有多大改变，刘海 有较大的变化，摄像头排布没有变化，运行速度挺快，流畅度也没的说，总体效果，很满意，很喜欢。
1024,外形外观：非常的精美，使用手感很好，很舒服屏幕音效：屏幕流畅丝滑，适合各个年龄段拍照效果：超级清晰还配有广角运行速度：很快，也不会有卡顿的情况发生待机时间：充满一次电，基本可以待机一整天
1025,运行速度：很快很流畅，不卡屏幕音效：观感很好，音效不错外形外观：手感不错，外观很好，经典耐看拍照效果：苹果拍照还是很不错的
1026,苹果手机的老用户了，从6到14，每一部的体验感都很好，这部苹果14用户体验度高，值得信赖的产品。京东物流快速便捷。外形外观：颜值担当，符合审美。屏幕音效：音质效果清晰。拍照效果：符合预期。运行速度：快速！待机时间：这点非常满意，不怎么玩儿30几个小时。
1027,外形外观：淡淡的紫色超级漂亮，超出预期的好看屏幕音效：屏幕清晰，音效超级棒，很喜欢拍照效果：还原本真的镜头，像素清晰度不容置疑运行速度：运行速度很快很流畅待机时间：超长待机，电很经得住用其他特色：小巧美观，拿起来手感刚刚好，非常喜欢，值得入手
1028,外形外观：小巧，轻便，裸机手感非常不错。屏幕音效：立体环绕音效，nice拍照效果：清晰，懂得都懂运行速度：不错，A15满血版，比安卓系统流畅多了（仅个人观点，不喜勿喷）
1029,苹果手机果然名不虚传，品质实在太好了，外观精美，做工精致，时尚大方，结实耐用，系统流畅，反应迅速，声音洪亮，拍照清晰，真的太爱苹果了！
1030,外形外观：挺好看的个人很喜欢屏幕音效：也很不错拍照效果：也很漂亮 拍出来很好运行速度：很快待机时间：还不错 算可以吧其他特色：物流很快 很有保障
1031,小米11安卓换苹果14，在小米13和苹果14之间踌躇了很久，最终还是想换换品牌用，小米用了四五年了！外形外观：回归苹果4那种方正，外观好看屏幕音效：细腻，强光下显示清晰拍照效果：拍照苹果还是很强的待机时间：续航真的顶，下班还有60左右的电
1032,手机手感很好，尺寸正合适，好，拍照也不错很漂亮，运行流肠，玩游又A15性感强大，屏养显示很细腻，续航也不错，立体声效果运行速度：很流畅丝滑，完美外形外观：外观很好，縱经典耐看
1033,紫色好看，淡淡的紫色，从8p换14的，一如既往的好用，流畅，拍照效果提升很大，屏幕大小我握着刚刚好，之前还怕屏幕太小了，待机时间也够长，运行速度：快。
1034,屏幕音效：天籁之音外形外观：大小正好，黑色大气，其实苹果不管什么颜色都好看拍照效果：清晰细腻运行速度：非常快，流畅，希望陪我再征战五年
